{
  "problem_validation": {
    "exists": true,
    "severity": 7.0,
    "frequency": 6.0,
    "willingness_to_pay": "15 to $60 per hour",
    "confidence_level": 8.0
  },
  "evidence": [
    {
      "source": "[TrustedHousesitters Forum]",
      "type": "Forum",
      "date": "May 2023",
      "quotes": [
        "\"Some homeowners prefer not to have their dogs walked due to large property sizes, safety concerns, or the dog's health and behavior.\"",
        "Communication with homeowners is crucial to understand specific needs."
      ]
    },
    {
      "source": "[Pet Business Insurance]",
      "type": "News\n- \"On average, dog walkers in the UK are paid \u00a314 for an hour-long walk.\"\n- Provides insight into the cost of dog walking services.\n\nALTERNATIVE SOLUTIONS:\n[Rover]: \n- Approach: Connects dog owners with walkers via an app.\n- Limitations: Reliability issues for same-day requests.\n\n[Care.com]:\n- Approach: Offers a platform to find local dog walkers.",
      "date": null,
      "quotes": [
        "Limitations: May not guarantee availability for short notice."
      ]
    }
  ],
  "alternative_solutions": [
    {
      "name": "[Rover]",
      "approach": "Connects dog owners with walkers via an app.",
      "limitations": "Reliability issues for same-day requests."
    },
    {
      "name": "[Care.com]",
      "approach": "Offers a platform to find local dog walkers.",
      "limitations": "May not guarantee availability for short notice."
    }
  ],
  "problem_statement_feedback": "The problem statement is accurate and highlights a genuine issue faced by dog owners. The evidence supports the existence of the problem, particularly in terms of availability and reliability for short notice requests.",
  "raw_text": "PROBLEM VALIDATION SUMMARY:\nExists: Yes\nSeverity: 7\nFrequency: 6\nWillingness to Pay: $15 to $60 per hour\nConfidence Level: 8\n\nEVIDENCE:\n[Reddit]: Forum (May 2023)\n- \"Dog walkers in my city are rarely same day available and Rover completely unreliable.\"\n- Availability of same-day dog walkers is limited, and services like Rover may not be reliable.\n\n[TrustedHousesitters Forum]: Forum (May 2023)\n- \"Some homeowners prefer not to have their dogs walked due to large property sizes, safety concerns, or the dog's health and behavior.\"\n- Communication with homeowners is crucial to understand specific needs.\n\n[Pet Business Insurance]: News\n- \"On average, dog walkers in the UK are paid \u00a314 for an hour-long walk.\"\n- Provides insight into the cost of dog walking services.\n\nALTERNATIVE SOLUTIONS:\n[Rover]: \n- Approach: Connects dog owners with walkers via an app.\n- Limitations: Reliability issues for same-day requests.\n\n[Care.com]:\n- Approach: Offers a platform to find local dog walkers.\n- Limitation..."
}